generacion,libro,pagina,texto,prediccion
2008,2,1,"G

he |
Del Porfiriato ~
a la Revolucién

exicana",Comunismo
2008,2,2,"Propésitos é€Qué sabes tu?

> Ubicar temporal y espacialmente los > Lee las adivinanzas y relaciénalas con sus
acontecimientos que caracterizaron al Porfiriato respuestas; después, comenten en grupo qué
y la Revolucién Mexicana. tanto saben acerca de la Revolucion Mexicana
> Identificar en fuentes algunas de las causas y de 1910.

consecuencias del Porfiriato.

> Reconocer en la Constituci6n de 1917 las
garantias individuales y sociales de los
mexicanos.

Reyolucién Mexicana

Carmen Serdan’

Porfirio Diaz",Socialismo
2008,2,3,"81

Panorama del periodo

+ Ubicacién temporal y espacial de los principales acontecimientos durante el |
Porfiriato y la Revolucién Mexicana.",Socialismo
2008,2,4,"Linea DE TIEMPO .
1875 1880 1885 1890 1895

México

Porfirio Diaz presidente 1884-1911

Bn | |

‘Se inventa el fondgrafo
®@enEstados Unidos

1877 |

ia

Resto del mundo |",Comunismo
2008,2,5,"Victotieno
Huerta
191 f 1914,

— f\
a)
Cee
19}7-1920

iy
@ Primers Guerra

repablica 1912 @ Mundial 1914-1918
|
| |
|",Comunismo
2008,2,6,">

Entre 1870 y 1920, nuestro pais vivid cambios muy importantes. Con la llega-
da de Porfirio Diaz a la presidencia, se inicié la recuperacién de la economia y
la reconciliacion entre los grupos que hasta entonces se disputaban el poder.
Ademas, se resolvié el problema de la deuda externa y comenzaron a llegar
a México algunas inversiones extranjeras.

Pero estos beneficios no llegaron a todos: gran parte de la poblacién con-
tinud viviendo en la miseria, sometida a trabajos excesivos y Con poca paga,
lo cual produjo gran descontento. Para mantener el orden, Porfirio Diaz esta-
blecio un gobierno dictatorial: reprimié duramente a quienes no estaban de
acuerdo con él, limité la libertad de expresién y se mantuvo en la presidencia
por mas de 30 afios, negandose a efectuar elecciones libres.

En este bloque estudiards las caracteristicas de este gobierno y el estalli-
do de la Revolucién Mexicana, la cual condujo hacia la redaccion de una nueva
Constitucién que planted soluciones a muchos de los problemas del Pais.

CUANDO Y DONDE PASO?
> 1. Observa la linea del tiempo de este bloque ® Construccién del ferrocarril.
y responde.
= -Cudntas décadas duré el Porfiriato? = Francisco I. Madero es elegido presidente
= ;-Cuanto tiempo goberné Francisco I. de México,
Madero?
= :Cuantos lustros duré la lucha armada? @ Constitucién de 1917.

> 2. Identifica los siglos a los que corresponden

estos procesos:

® Inicio de la explotacién del petrdleo.

> 3. Observa el mapa y la simbologia, identifica
y enlista los estados donde luché cada lider o
caudillo revolucionario,",Neoliberalismo
2008,2,7,"Compa de Fires Constnucealets
ey See tl er cet cee
‘Avaro Obregos

[ay Seagate Ae a Dorn dt Hore
Francaco vite

Cormpuala del Fico del Noveste
BB bo concer

Aa et Fjdeho Gel beracor
Erkan Zapata

Golfo de México

> 4. En tu cuaderno, elabora y completa el
siguiente cuadro. En la columna en blanco,
coloca el nombre de uno o mas personajes
de tu localidad 0 estado que sepas que hayan
participado en la Revolucién.

Personaje",Socialismo
2008,2,8,"Temas para comprender
el periodo

éPor qué surgié la Revolucién Mexicana?

¢Qué es una revolucién?, équé puede provocarla? Piensa en algunos cam-
bios que hayas tenido en tu vida; seguramente muchos no los percibes inme-
diatamente (como cuando creces, no te das cuenta sino hasta que tu ropa
ya no te queda) y otros son mucho mas notorios, como cuando te cambias
de casa o de escuela.

Una revolucion es una serie de cambios que en ocasiones son violentos
y Provocan transformaciones importantes en la organizacion de un pais yen
la vida de las personas.

Para OpseRvapores

> Observen las imagenes, y con ayuda de su
maestra 0 maestro, escriban en el pizarrén lo
que representa cada una de ellas. Al terminar el
bloque, escriban entre todos un texto breve en

el que contesten las preguntas del principio de
este tema,

Bloque 3",Populismo
2008,2,9,"Las diferencias politicas entre
los liberales y la consolidacién
de la dictadura de Porfirio Diaz

Como recordaras, durante la primera mitad del siglo xix, hubo varios con-
flictos entre liberales y conservadores.

Entre los liberales que derrotaron la invasion francesa, también sur-
gieron diferencias. Asi, se formaron dos grupos: los civiles que acompa-
fiaron a Benito Juérez desde la Guerra de Reforma y los militares, que
adquirieron prestigio durante la intervencion francesa y eran encabeza-
dos por Porfirio Diaz; estos ultimos eran mas jovenes y tuvieron una vision
distinta de como aplicar las reformas liberales. Por ejemplo, buscaban mejo-
rar la relacion con la Iglesia e impulsaron la reorganizacién de la economia
nacional y las instituciones de gobierno.

Con el triunfo de la Republica, en 1867, Juarez volvid a ser elegido pre-
sidente por un periodo de cuatro afios mas; con ello se prolongo el mandato
que ejercia desde 1858. En 1871, Juarez se postulé de nuevo para la presi-
dencia; su contendiente fue Porfirio Diaz. Ninguno de los candidatos obtuvo
la mayoria absoluta, asi que el Congreso decidié dar el triunfo a Juarez. Ante
esto, Diaz prociamé el Plan de la Noria, en el que exigia la no reeleccién y
hacia un llamado a desconocer el gobierno; aunque Diaz tuvo seguidores, la
revuelta no se extendié, pues meses mas tarde, Benito Juaréz murid. Ante este
suceso, Sebastian Lerdo de Tejada, presidente de la Suprema Corte de Justi-
cia, asumio la presidencia de forma interina y convocd a nuevas elecciones.

Benito Juarez.

Porfirio Diaz.",Liberalismo
2008,2,10,"Exillo Lerdo de Tejada fue presidente de 1872 a 1876; durante su mandato se
Abandonar el pais de origen enfrentd a la Iglesia porque aplicd las Leyes de Reforma. Asimismo, impuls6é

por causas politicas:

el federalismo, la separacion y el equilibrio de los tres poderes, la participa-

cién publica mediante el voto y el respeto a los derechos civiles, como la
libertad de expresién y el respeto al voto.

Terminado su periodo, Lerdo buscé reelegirse, lo cual provocé fa incon-
formidad del Congreso y de Porfirio Diaz. Este volvid a levantarse en armas,

Caricatura publicada en
La Orquesta, (1877).

‘ey nueria, Placpe caronade

Bloque 3

y se puso al frente del Plan de Tuxtepec, en el que se exigia la no reelec-

cién, Diaz recibio un amplio respaldo en toda la
Republica y finalmente Lerdo se vio obligado a
renunciar y a exiliarse en Estados Unidos.

Porfirio Diaz fue elegido presidente y asumio
su cargo en 1877. Los primeros cuatro afios
de su gobierno fueron de ajustes y busqueda
de paz. Consiguié aliarse con mas personas y
fortalecer su poder mediante la conciliacion;
asi, por ejemplo, incluy6 a algunos liberales en
su gabinete; ademas, pacté con los caciques
regionales y puso a sus hombres de confian-
za al mando del ejército. También se propuso
desarrollar un proyecto nacional, unificar a los
liberales y reconciliar al gobierno con la Iglesia y
los conservadores.

Por otro lado, realizé cambios a la Constitu-
cidn; la primera modificacién fue al articulo 116
que le daba al presidente el derecho para inter-
venir en los estados en caso de amenaza inter-
na o externa y en la eleccién de ministros de la
Suprema Corte.

En 1880, e| general Manuel Gonzalez, quien
era amigo cercano de Diaz, fue elegido presi-
dente. Durante su gobierno, continud la reor-
ganizacion del pais: se construyeron grandes
extensiones de vias férreas, se crearon el Banco
Nacional de México y la Loteria Nacional; ade-
mas, se reabrid el Colegio Militar, se firmdé el",Conservadurismo
2008,2,11,"En 1884, el general Diaz volvié a ocupar la presidencia. Las acciones que Dictadura
emprendid le permitieron fortalecer su poder y mantener la estabilidad. Contd Gabiemo que oeroe 0) poder
con el apoyo de importantes sectores de la sociedad, sobre todo ‘politicos, ay more
militares, inversionistas, terratenientes y clases medias, quienes consideraban
que Diaz debia permanecer en el gobierno para mantener el orden y el creci-
miento econdmico del pais.

Gracias a esto, en los siguientes afios Diaz se reeligié cinco veces segui- LTA ig re Fe
das. Su gobierno se convirtié en una dictadura, porque eliminé las libertades —ofrenda a Porfirioporti.
Politicas, censurd a la prensa, reprimidé violenta-
mente las protestas sociales, impidié que se lle-
varan a cabo elecciones libres e impuso a los a
gobernadores de los estados; ademas, las institu- j i ii
ciones de justicia y el poder legislativo obedecian -
sus Ordenes. Esta etapa de la historia de México
se conoce como Porfiriato.

Caricatura publicada en La Orquesta, que
representa a México como una torre de Babel.

Para OBSERVADORES

> Observa las imagenes de este tema: zqué puedes
apreciar en ellas? ¢Qué dicen los textos que las
acompafian? Explicalas con tus propias palabras.

En caso de que desconozcas alguno de los",Dictadura
2008,2,12,"El Porfiriato
wa Estabilidad, desarrollo economico
Be e inversion extranjera

En el area econdmica, Porfirio Diaz buscé atraer inversiones extranjeras, para
'o cual ofrecié a los empresarios facilidades y ventajas para hacer negocios
en México.

La mineria, la electricidad, el petrdleo, la construccién de ferrocarriles, la
produccién de hilados y tejidos, y en general las comunicaciones (teléfonos,
telégrafos, bancos, puertos) fueron las principales actividades econdmicas
de la época y empresarios de Estados Unidos, Francia, Alemania y Gran
Bretajia, invirtieron en ellos.

Gracias a las inversiones, tanto extranjeras
como nacionales, se reactivé el comercio, se esti-
muld el crecimiento de las ciudades, se generd
empleo y se impulsé la produccién agricola; todo
esto permitid que mejoraran las condiciones de
vida de la clase media y los profesionistas. No obs-
tante, los beneficios de esta prosperidad no llega-
ron a otros sectores de la poblacién como cam-
pesinos, obreros, artesanos, jornaleros, pequefios
comerciantes e indigenas.

Un dato interesante

> :Hay algo mis fuerte que el acero? :Sabias que
muchos de los cables que sirven para sujetar a
los barcos, actualmente, son elaborados con la
fibra natural del henequén, de origen yucateco?

Mineros. Esto ha pérmitido sustituir las gruesas cadenas

md a de acero que durante mucho tiempo fueron -

empleadas en todos los puertos del mundo.

Para DETECTIVES Esta planta se sigue utilizando también para
Deporte de origen estadunidense cuyos confeccionar cuerdas, cordeles, hamacas, sogas.
jugadores usan gorra y guante; esta mas c incluso jabén.. 0 de he

difundido en el golfo de México, y lleg6 a rtantes, I

nuestro pais durante el Porfiriato, zcual es?

Bloque 3",Capitalismo
2008,2,13,"Hacia 1884, la inversion extranjera era de 100 millones de pesos y para
finales del Porfiriato se elevé 34 veces mas y estaba repartida como se indica
en el siguiente cuadro:

Inversi6n extranjera en México (porcentaje por pais)

Sector Estados Unidos | Gran Bretafa Francia

Bancor

Ferrocarriles

Servicios

Publicos

Industria

Comercio

Alemania

Trabajadores dela
Oficina de Telégratos
(ca. 1900).",Neoliberalismo
2008,2,14,"COoMPRENDO Y APLICO
> Observa la informacién del cuadro y responde
en tu cuaderno.
Identifica cudles fueron los sectores donde hubo
mayor inversion extranjera. 2Qué beneficios
° piensas que obtuvo México con esa inversién?

Red ferroviaria en 1910

> Observa el mapa, localiza y contesta en tu
cuaderno. :Cudles fueron los estados en donde
se construyeron mas vias férreas?, gpor qué?",Neoliberalismo
2008,2,15,"Ciencia, tecnologia y cultura

Al final del siglo xix, empezé un proceso de modernizacién en nuestro pais,
debido al cual la vida en algunas ciudades tuvo cambios notables; en gene-
ral, la tecnologia transform6 la vida y el paisaje de diversas regiones del pais.
Por ejemplo, se construyeron numerosas vias ferroviarias, lo que ayudé a
la integracion y el fortalecimiento econémico de diferentes zonas del pais,
pues los viajes en tren resultaron mas rapidos, comodos y seguros. También
se introdujeron otros transportes, como el automévil, el tranvia eléctrico y la
bicicleta, que permitieron mejorar el traslado de personas y sustituyeron alas
Carretas y tranvias tirados por mulas.

Un dato interesante

[Ante los avances en las comtnicaciones}, ef municipio [de la Ciudad
de México] creyé que, por fin, habia acabado con el problema del
excremento en las calles al momento de jubilar las mulas y los caba-
llos que jalaban los viejos tranvias, por lo que, ademas, los transetin-
tes dejarian de ensuciarse los zapatos. Muy pronto se descubrié que
ahora en el pavimento caia aceite proveniente de las nuevas maquinas
motorizadas y que la poblacién podia resbalarse o manchar su ropa.

Fuente: Judith de la Torre Rend6n, “La ciudad de México en los albo-
res del siglo xx"", en Vida Cotidiana, t. V, vol. 2, p. 27.",Neoliberalismo
2008,2,16,"94

Las comunicaciones y otros avances tecnolégicos modificaron la vida
laboral y cotidiana. Con la generacién y el uso de la electricidad en las ciuda-
des, se favorecié una actividad nocturna mas intensa.

Por ejemplo, el cinematografo dio
nuevos espacios de diversion y espar-
cimiento a la sociedad; la camara foto-
grafica representd un medio para perpe-
tuar escenas Cotidianas y personajes de
la época, y los teléfonos se volvieron el
contacto de comercios y casas adinera- |
das que tenian acceso a este medio de
comunicacién.

Sin embargo, la introduccion de estos
avances hizo mas evidentes las desiqual-
dades sociales en el pais. El crecimien-
to econdmico local y regional se logré
a costa de los menos afortunados, y en
general, la industrializacién implicé el
dominio de unos cuantos. Las ciudades
fueron el escenario en donde se podian
observar los enormes contrastes entre la
riqueza y la pobreza.

Café de ta Concordia (1871).

Consutta EN...

Si quieres conocer mas acerca de este tema te -
sugerimos leer: Wraisz
Varios autores, La revolucion a todo vapor,

México, sep-Ediciones Tecolote, 1994 (Libros Para DETECTIVES

del Rineén), Es un deporte muy popular en nuestro pais;
Varios autores, Noticias de fin de siglo, México, en él sélo se pueden usar los pies para golpear

sep-Ediciones Te¢olore, 1996 (Libros del un balén; es de origen inglés y lleg6 a México

Rinc6n). _ durante el Porfiriato.

eS

Bloque 3",Comunismo
2008,2,17,"95

CoMPRENDO Y APLICO

> En equipos observen las imagenes de este tema
ec identifiquen en ellas los avances tecnolégicos y
en las comunicaciones. Preguntales a tus abuelos
u otras personas mayores si recuerdan algunos
de esos objetos o los usaban cuando eran nifos.
Escribe en tu cuaderno las diferencias que

Nifias y nifios a finales del siglo xix

Hacia finales del siglo xtx, México vivid

una serie de adelantos tecnolégicos; éstos se
reflejaron también en los juguetes. Por ejemplo,
los nifios de esos afios vivieron la aparicién del
ferrocarril; los artesanos mexicanos reflejaban
este hecho construyendo trenecitos de madera,
cart6n o lamina que se convertirian en los
juguetes favoritos de los nifios.

Eugenia Meyer, Nifios de ayer, niftos de
hoy, México, Lumen-tnaH-Gonaculta, 2007,
{Coleccién Huellas de México, serie Ecos),",Comunismo
2008,2,18,"96. |

oa | corona Movimientos de protesta: campesinos

inconiomidadesde ~=»s- YW ODTErOs

Jon diferentes grupos
sociales del Porfiriato.
Una vez establecidas las reformas liberales, el pais enfrenté un nuevo pro-
Reiaicic blema: el de la propiedad de la tierra; para ello, el gobierno puso a la venta

Gran extension de tierra que '@8 tierras comunales y de la Iglesia, ofreciéndolas a quienes tuvieran los

sirve para las labores agricolas recursos para adquirirlas, Algunos empresarios y hacendados compraron

yganaderas, pertenecientea grandes extensiones de tierra y formaron latifundios. Aunque de esta forma

oar neo pines lograron aumentar la produccion agropecuaria, afectaron a otros sectores de

a al poblacién como a las comunidades indigenas y campesinas y a pequefios

rancheros, quienes perdieron sus propieda-

des o no pudieron competir con los grandes
hacendados.

Esta situacién provocé a finales de!
siglo xix, el descontento de gran parte de
la poblacién rural mexicana, dando pie a
levantamientos campesinos en los estados
de Veracruz, Hidalgo, Valle de México, Chi-
huahua, San Luis Potosi, Nayarit, Sonora,
Guerrero, Oaxaca, Chiapas y Yucatan, los
cuales fueron reprimidos con violencia.

Unos cuantos mexicanos y extranjeros
eran los duefios de la tierra y las fabricas. En
cambio, la mayoria de la poblacién no poseia
una parcela para sembrar, ni podia trabajar

Obreras en Rio Blanco,
Veracruz (ca. 1906).

Pancramicqdde la tabricn

Bloque 3",Populismo
2008,2,19,"de forma independiente por la falta de recursos; al no tener otra opcién para
sobrevivir, trabajaban como obreros en las fabricas 0 como peones en las
haciendas.

Tanto en el campo como en las fabricas, la jornada de los obreros y
peones era de 12 a 15 horas diarias y recibian un salario que no alcanzaba
para cubrir sus necesidades basicas; ademas, sus viviendas eran pobres,
Con frecuencia se les pagaba con vales en lugar de dinero, para comprar
en las tiendas de raya, que era el lugar donde vendian a costos muy altos
los alimentos basicos; esta forma de pago los obligaba a solicitar préstamos
por adelantado, que, muchas veces, los endeudaban de por vida; frecuente-
mente eran maltratados con golpes y castigos, sobre todo en las haciendas
del sur del pais. Esta explotacién era posible porque no existian leyes que
protegieran a los trabajadores. Los mejores puestos eran para los extranjeros,
dejando de lado a los trabajadores mexicanos.

Los obreros se organizaron en sindicatos y asociaciones para defender
sus derechos. Utilizaron la huelga como un recurso para exigir mejores condi-
ciones de trabajo. Pero estos movimientos fueron reprimidos por el gobierno
porfirista. Entre las huelgas mas importantes destacaron la de los mineros de
Cananea, Sonora, en 1906, y la de la fabrica textil de Rio Blanco, Veracruz,
en 1907.

Huelga
Suspensién de labores en un
centro de trabajo para exigir
a los patrones la satisfaccién
de ciertas demandas de los
twabajadores, como aumento
de salario, prestaciones,
seguridad en el trabajo,
etcétera.",Capitalismo
2008,2,20,"98 __

CompPRENDO Y APLICO
Cananea, 2 de junio de 1906.

En un franco desafio a las autoridades patronales, los mineros de la
Cananea Copper Co. se lanzaron ayer ala huelga, para manifestar su
descontento por las condiciones laborales y por la notoria diferencia
que priva entre los mexicanos y los norteamericanos que trabajan
en la empresa. Los primeros ganan tres pesos por jornadas de diez y
doce horas, mientras que los segundos reciben siete pesos por menos
horas de trabajo. El presidente de la compaiifa, el coronel William C.
Greene, demostré su asombro al ver que todos los mexicanos partici-
pan en la huelga. Contest6 el pliego petitorio de los mismos mineros
en términos que invalidan las exigencias de los trabajadores.

EI pliego petitorio de los mineros incluye, entre otros puntos,
sueldo minimo de cinco pesos diarios con ocho horas de trabajo; los:
mismos derechos para mexicanos y norteamericanos y opipae en la
compafiia 75% de mexicanos. *

La situacion en Cananea se ha vuelto critica. = lo at
desfila por las calles y se ha colocado en pleno reto, enfrente de las
oficinas de la empresa. Los norteamericanos se encuentran adentro

Bae Sas REG ae ee

intereses a cualquier precio...

Py

Carcel de Cananea, 90
Fuente: Tiempo de México, México, sev, 1984, a0 as

> 1. Lee el texto anterior y contesta las preguntas
en tu cuaderno:

¢Qué motivé la huelga?

éQuiénes la iniciaron?

¢Cudles eran sus demandas?

¢Consideras que las peticiones eran justas?, zpor
qué?

Si fueras el duefio de la empresa, ¢qué harias
para evitar una huelga?

Bloque 3",Comunismo
2008,2,21,"La Revolucion Mexicana

La oposicion de Francisco |. Madero,
su ideario democratico y el inicio
de la Revolucién Mexicana

Hacia finales del siglo xix y principios del xx se formaron distintos grupos
politicos que exigieron elecciones democraticas. Asimismo, se fundaron
periddicos opositores al gobierno, como E/ Hijo de! Ahuizote, Excélsior
y Regeneracién.

En 1908, Porfirio Diaz concedié una entrevista al periodista estadu-
nidense James Creelman, en la cual afirmé que no pensaba competir en
las siguientes elecciones presidenciales, pues consideraba que México
estaba listo para gobernarse democraticamente. Pero en realidad él no
tenia la intencién de abandonar el poder.

COoMPRENDO Y APLICO

LA SUCESION PRESIDENCIAL EN 1910

Caricatura publicada en E? Hijo de! Ahuizote.

Sobre todo, hay que tener presente que cualquier
ventaja, cualquier concesién, cualquier conquista ate

obtenida por las prdcticas d iivesbanse anartoea es
duradera, mientras que un triunfo, por importante ; ae
que sea, obtenido con las armas, no hard sino agravar
nuestra situaci6n interior (p. 302),

> Lee el fragmento de La sucesién presidencial. En ese libro,
Madero menciona algunas “practicas deniocraticas”.
¢Cudles son? ;Qué importancia tienen para México en la
actualidad? Discutan en grupo las respuestas y lleguen a
una conclusién.

CONSULTA EN...
Si quieres conocer el texto completo te sugerimos consultar la pagina:",Socialismo
2008,2,22,"Carmen Serdan,

Para DETECTIVES

Pais de Europa que influyé culturalmente sobre
los grupos adinerados de México durante

el Porfiriato, en la arquitectura, el uso de

la moda para i

perfumes

Bloque 3

Ese mismo afio, Francisco |, Madero publicé su libro La sucesién presi-
dencial en 1910, en el cual propuso crear un partido politico que se opusiera
ala reeleccién de Diaz. Al afio siguiente funds el Partido Nacional Antirreelec-
cionista y se postuld a la presidencia de la Republica. Como candidato, viajd
por el pais para dar a conocer sus ideas politicas, destacando entre ellas su
empefio en convertir a México en un pais democratico, gobernado por la ley
y donde los distintos grupos sociales vivieran en armonia.

Madero obtuvo gran apoyo entre los ciudadanos que se disponian a votar
por él como presidente en las elecciones de 1910. Esto alarmé a Diaz, quien
ordend encarcelarlo bajo el cargo de sublevar a la poblacién y de ultrajar a

las autoridades. De este modo las elecciones se realizaron mientras Madero

se hallaba preso. Los votos a su favor fueron anulados de modo que Porfirio

Diaz volvid a ganar la presidencia. Madero logré escapar y publicé el Plan
de San Luis, por medio de! cual convocaba a la poblacién a levantarse en
armas contra el gobierno.

Su llamado encontré respuesta en diversas regiones del pais: en Chihu-
ahua, con Francisco Villa y Pascual Orozco; en Puebla, con los hermanos
Aquiles, Maximo y Carmen Serdan; y en Morelos, con Emiliano Zapata. Para
Principios de 1911, los levantamientos se extendieron exitosamente por
diferentes regiones. En mayo, el general Diaz renuncié a la presidencia y
abandon el pais. Enseguida se realizaron elecciones libres en las que resulto
triunfador Francisco |. Madero.

Madero traté de gobernar con apego a la ley y respetando las libertades
democraticas, Sin embargo, enfrent6 graves problemas. Algunos de sus parti-
darios esperaban respuestas inmediatas a las demandas sociales y al no obte-
nerlas se alzaron en armas nuevamente, como sucedié en e! caso de Emiliano
Zapata. Por otra parte, ni los antiguos porfiristas ni los empresarios extranjeros
favorecidos por Diaz, veian con buenos ojos al nuevo presidente.

En febrero de 1913, un grupo de militares, apoyados por el embajador
de Estados Unidos, se rebelaron contra el gobierno en la Ciudad de México,
Este episodio fue conocido como la “Decena Tragica"" porque en los 10 dias
que duraron los combates murieron miles de personas. Madero y el vicepre-
sidente José Maria Pino Sudrez fueron asesinados por érdenes del general
Victoriano Huerta, quien usurpé la presidencia de México.

Ante este hecho, Venustiano Carranza, gober-
nador de Coahuila, elabord el Plan de Guadalupe,

desconocia a Victoriano",Socialismo
