generacion,libro,pagina,texto,prediccion
2008,2,23,"101

| El desarrollo del movimiento armado
y las propuestas de los caudillos
revolucionarios: Emiliano Zapata,

Cauditio

Francisco Villa, Venustiano Carranza Lider ce a partirdie sie ouslidedes
y Alvaro Obregon piteupaon esau

militar, A cambio de! apoyo y lealtad
de sus seguidores, los caudillos
realizaban acciones para satisfecer

Durante la Revolucién, en distintas partes del pais se levantaron en armas
grupos revolucionarios con diferentes proyectos politicos. Estos se organi-
zaron en torno a caudillos como Emiliano Zapata, Francisco Villa, Venustiano
Carranza y Alvaro Obregén. Cada uno de ellos elaboré un documento en el
que plasmaron sus demandas.

El Plan de Ayala, propuesto por Emiliano Zapata, demandaba el reparto
de tierras a indigenas y campesinos, y también exigia la entrega de terrenos,
montes y aguas a quienes los necesitaran. El movimiento zapatista expresaba
las demandas de los campesinos mexicanos que habian sido despojados por
los hacendados porfiristas, por lo que peones, jornaleros y otros trabajadores
del campo del centro y sur del pais se unieron a dicho movimiento.

El movimiento villista representd los anhelos y las necesidades de los tra-
bajadores del campo en el norte del pais, quienes reclamaban el reparto de
las tierras de las grandes haciendas agricolas y ganaderas donde trabajaban.
Villa elaboré la Ley Agraria General, en la que destacaba la reducci6n de las.
grandes propiedades territoriales a limites justos, distribuyendo equitativa-
mente las tierras excedentes.

El general Francisco Villa y su escolta.

Un dato interesante

El ferrocarril fue un medio
de transporte muy utilizado
durante la revoluci6n.
Facilité el traslado de grandes
ejércitos a largas distancias.
Esto le dio al movimiento
armado un caracter dindmico.
Por eso en los testimonios",Nacionalismo
2008,2,24,"102.

Venustiano Carranza fue gobernador de Coahuila durante el gobierno
de Madero y a su muerte se convirtié en el principal lider revolucionario.
Consideré necesario reformar la Constitucién para favorecer de manera mas
equitativa la sociedad, el comercio, la industria y favorecer la educacién. A su
ejército se le conocié como constitucionalista.

Alvaro Obregon apoyé a Carranza y se sumo al e@jército constitucionalis-
ta, pues coincidia con él en la idea de hacer de México un pais préspero y
moderno.

Cuando Victoriano Huerta usurpé la presidencia, villistas y zapatistas
se unieron a Venustiano Carranza para combatirlo, Ante esto,
en agosto de 1914, Huerta dejé el pais y Carranza,
que habia sido reconocido como jefe por otros cau-
dillos, como Francisco Villa, Emiliano Zapata y el
sonorense Alvaro Obregon, entré triunfante en la
Ciudad de México.
Posteriormente, Carranza ocupé la presidencia;
pero entonces los revolucionarios se enfrentaron, pues
muchos, entre ellos Zapata y Villa, no estuvieron de acuer-
do, porque pensaban que no se identificaba con los intere-
ses del campesinado, Los jefes revolucionarios se reunieron en
Aguascalientes y nombraron presidente a Eulalio Gutiérrez.

Nifios y nifias en la Revolucién

Muchas veces los nifios y las nifias entre los 7 y

los 12 afios, desempejiaron diferentes actividades
durante la lucha revolucionaria, aunque algunos
participaron en combate, otros tuvieron tareas
como tocar el redoblé de tam",Socialismo
2008,2,25,"103

Asi, los revolucionarios quedaron divididos en dos bandos: por un lado
los carrancistas y, por otro, villistas y zapatistas. En el bando carrancista
destacé el general Alvaro Obregon, quien dirigid con gran éxito al ejército
constitucionalista. Bajo su mando las tropas de Carranza lograron victorias
decisivas sobre sus adversarios en 1915.

ComPRENDO Y APLICO
> Las ideas de reforma social quedaron plasmadas en
el Plan de Ayala y la Ley Agraria; a continuacion te

presentamos un fragmento de cada uno.

Alvaro Obregon.

Plan de Ayala

@ Art. 6°. Que los terrenos, montes y aguas
que hayan usurpado los hacendados |...
© caciques a la sombra de la tirania [...]
entraran en posesién de estos bienes [...] los
pueblos o ciudadanos que tengan los titulos
correspondientes de esas propiedades, de las
cuales han sido despojados por la mala fe de
nuestros opresores.

w Art. 7°. En virtud de que la inmensa mayoria
de los pueblos y ciudadanos mexicanos, no
son mas duefios que del terreno que pisan,
sufriendo los horrores de la miseria sin poder
mejorar su condicién social [...] por estar
monopolizados en unas cuantas manos las
tierras, Montes y aguas; por esta causa se
expropiaran [...] a los poderosos propietarios
de ellos, a fin de que los pueblos y ciudadanos
de México obtengan ejidos, colonias, fundos
legales para pueblos o campos de sembradura
o de labor.

Noviembre de 1911

DpsPian de Ayala, 1911,",Nacionalismo
2008,2,26,"Ley Agraria

m Art. 1°. Se considera incompatible con la paz y la prosperidad de
la Republica la existencia de las grandes propiedades territoriales.

@ Art. 3°. Se declara de utilidad piiblica el fraccionamiento de las

@ Art. 4°, Se expropiaran también los terrenos circundantes de los
pueblos de indigenas en la extensién necesaria para repartirlos en
pequeiios lotes entre los habitantes de los mismos pueblos.

w Art. 5°. Se declara igualmente de utilidad piiblica la expropiacién
de los terrenos necesarios para fundacién de poblados en los
lugares en que se hubiere congregado o Ilegare a congregarse
permanentemente un numero tal de familias de labradores [...]

y para la ejecucién de obras que interesan al desarrollo de la
agricultura parcelaria y de las vias rurales de comunicaci6n.

Mayo de 1915

> Qué problemas se buscaba resolver con estos
decretos? ¢Quiénes serian beneficiados con estas
medidas?",Nacionalismo
2008,2,27,"La Constitucién de 1917, sus principios
y principales articulos

La victoria del bando constitucionalista sobre Villa y Zapata permitid que
Carranza asumiera la presidencia y convocara a un Congreso en Querétaro,
con el propésito de redactar una nueva Constitucién para el pais, la cual se
promulgé el 5 de febrero de 1917, y es la que nos rige actualmente.

Esta nueva constitucién retomé los principios liberales plasmados en la
Constitucién de 1857, y también incorporé principios nacionalistas y algunas
demandas sociales por las que el pueblo habia luchado durante la revolucién.
Ha sido reformada para adaptarla a los cambios de los tiempos, pero sus
principios basicos siguen vigentes. Garantiza la igualdad ante la ley de todos
los ciudadanos, las libertades de reunién, expresién y transito, asi como otros
derechos fundamentales plasmados en los siguientes articulos.

m Art. 3°. La educacién que imparta el Estado sera
gratuita, laica y obligatoria.

m Art. 27°. Las tierras, montes, aguas y productos
del subsuelo pertenecen a la Nacién. (Con este
articulo se reafirmaba el aspecto social de la
propiedad, entendida ésta como dominio trans-
mitido de la Nacién a los particulares. Con éste
se sentaron las bases del reparto agrario y la
expropiacién del petréleo).

= Art. 123°. Establecié las relaciones obrero-pa-
tronales: jornada laboral de ocho horas, el dere-
cho a la seguridad y a la asistencia social, el
derecho a huelga, la igualdad de oportunidades
en el trabajo para todos los ciudadanos.",Conservadurismo
2008,2,28,"La cultura revolucionaria

El pueblo mexicano fue el protagonista del movimiento revolucionario. Duran-
te la lucha participaron cientos de miles de personas, hombres, mujeres y
nifios, de diferentes grupos sociales. La mayoria fueron indigenas, campesi-
nos, rancheros, obreros y empleados, entre otros.

La revolucién modificé la vida de las personas, sus valores y expresiones
culturales, La violencia, los continuos traslados a otras regiones, las penurias
de la guerra, el hambre y la pobreza, desarraigaron a familias enteras, propi-
ciando, en medio de la guerra y de los ejércitos federales y revolucionarios, ‘
un amplio intercambio cultural. La musica fue parte de la cotidianidad popular,
os ejércitos pasaban largas horas vigilando y en espera de un posible ataque,
Pero a ratos y para entretenerse entonaban canciones 0 corridos, que conta-
ban las hazafias e historias de los personajes 0 caudillos revolucionarios.

Con el tiempo, la cultura de la revolucién pasé a formar parte de la cultu-
ra nacional, dando lugar a expresiones artisticas como la musica, la pintura,
escultura, literatura y el cine.

Consutta en...

Para saber mas acerca de las canciones de la
época te recomendamos:

Maria Luisa Valdivia Dounce, Cancionero
mexicano, México, sep, 1988 (Libros del
Rincén),

ComPRENDO Y APLICO

> 1. En equipos inventen un corrido. Tomen
en cuenta los siguientes puntos: escojan un
acontecimiento, describan cuando sucedié y
quiénes participaron; adapten su corrido a una
cancion que les guste.

> 2. Expénganlo frente a sus compaiieros.",Progresismo
2008,2,29,"| Para OBSERVADORES
> Relaciona las imagenes con el texto y traza una
linea a la respuesta correcta.

Viajamos con la tropa, siguiendo a
mi apa. Nos dabamos tiempo pa’

jugar al gato y al ratén.

El cansancio nos vencia. Pero
seguiamos a mi general con gusto.

Su vida durante la Revolucion

se mostré en las pantallas.

Los acompafiamos en la guerra, les
hacemos la comida ¢ incluso tomamos
Jas armas para defendernos.",Populismo
2008,2,30,"108.
a: Temas para reflexionar

La influencia de las culturas extranjeras

Durante el Porfiriato, la cultura y el arte de México recibieron influencia de
otros paises. La mayoria de las comunidades extranjeras (espafolas, alema-
nas, francesas, inglesas y estadunidenses), establecieron algunas de sus
Costumbres, modas, conocimientos técnicos, laborales, culinarios y creencias
religiosas, que adoptaron principalmente los empresarios y las clases altas
mexicanas.

Las familias de la aristocracia mexicana acostumbraban mandar a sus
hijos a estudiar al extranjero, quienes trajeron nuevos conocimientos, modas
@ influencias artisticas y algunos regresaban como médicos, abogados, escri-
tores o pintores.

La élite mexicana adopto rapidamente
las formas de divertirse de los estaduni-
denses e ingleses. Se fundaron clubes,
casinos y centros de actividad social,
deportiva y cultural. El Lakeside Sailing
Club organizaba regatas en el lago de
Chalco y Xochimilco, El Jockey Club, el
Reforma Country Club y el Monterrey

Gymnastic Club, contaban con cam-
_ pos de golf, canchas de tenis, y salas
| para teatro, bailes y conciertos.

Bloque 3",Nacionalismo
2008,2,31,"La influencia francesa también fue notoria en la vida cotidiana de la socie-
dad mexicana de la época. Se observé en las costumbres urbanas, como en
los cafés, restaurantes, en la literatura, la moda, las diversiones como en las
funciones de opera, ballet, conciertos y bailes.

Asimismo, se destacé en las construcciones como el Palacio de Bellas
Artes y el edificio de Correos en la Ciudad de México; los teatros: Juarez, en
Guanajuato; el de La Paz, en San Luis Potosi; el Doblado, en Ledn; el Calde-
ron, en Zacatecas y el Pedn Contreras, en Mérida.

La influencia francesa
también se manifesto en las
tepresentaciones artisticas.

Para DETECTIVES

> Con las pistas del bloque, conaciste qué
deportes se introdujeron en México durante el
Porfiriato y viste que la cultura francesa influy6
én algunos grupos de la sociedad mexicana.
Elabora una investigacion en la que expongas
qué otras influencias de Estados Unidos,
Inglaterra y Francia se han introducido en",Comunismo
2008,2,32,"Bloque 3

La vida en las haciendas

Las haciendas eran grandes propiedades para sembrar la tierra y criar el
ganado. En ellas se cultivaban productos como la cafia de azucar, el tabaco,
el henequén, los cereales y el algodén, y se elaboraban bebidas como mezcal
y pulque. Este ultimo, fue muy popular entre los grupos populares por su valor
nutrimental y precio accesible.

Hubo haciendas que, por su extensién, ejercian influencia no sélo en los
poblados cercanos sino en otros estados del pais. Quienes trabajaban eran
Peones, empleados y sirvientes, algunos laboraban de manera temporal, pero
la gran mayoria vivia en ellas.

La administracion de las haciendas llegé a ser una profesién, pues muchos
hacendados no siempre podian ocuparse del manejo directo del dinero, Con
frecuencia, los duefios se ausentaban durante largas temporadas, porque
vivian en las ciudades, sdlo pasaban estancias cortas en ellas, sobre todo para
el descanso, la diversion o alguna celebracién o fiesta teligiosa. Por lo general,
cada hacienda tenia una capilla, una tienda de faya, un almacén, una escuela,
una carcel, una troje o lugar en donde se guardaban los granos, jacales donde
vivian los peones y la casa grande, que tenia todas las comodidades, como luz
eléctrica, bafios, salas espaciosas e incluso salones de billar.",Capitalismo
2008,2,33,"La tienda de raya, muy importante en la hacienda, era el lugar donde
se vendian productos basicos como jabén, maiz, frijol, aguardiente y otros.
Normalmente los productos eran de mala calidad y se vendian a precios mas
altos que en los mercados. El jornal o salario se pagaba con esos articulos
y, en pocas ocasiones, con dinero. El administrador llevaba el registro de las
compras y las deudas, que se heredaban a los hijos,
en caso de que sus padres murieran, por lo que nunca
terminaban de pagar.

La vida en las haciendas también tenia sus contras-
} tes: mientras en Yucatan los trabajadores vivian casi en
| la esclavitud, en lugares del norte del pais, por ejemplo,

Peones del estado de Oaxaca.

muchos peones recibieron buen trato y condiciones de
trabajo dignas, de modo que, ante los disturbios cam-

| pesinos contra las propiedades, fueron sus principales
defensores.

ComPRENDO Y APLICO

> Organicense en parejas y elijan una de las parejas
de personajes que se presentan a continuacién.
Elaboren un didlogo y recreen un dia en la vida
en una hacienda. Al terminar, exp6ngalo frente
a sus compajieros y reflexionen acerca de como
se imaginan que era la vida cotidiana en una
hacienda porfiriana.

Campesino -> Encargado de la tienda de raya

Campesina > Hijo o hija campesinos
Hacendado > Capataz

Campesino > Esposa del campesino

Capataz

Campesino

Hacendado

*",Capitalismo
2008,2,34,"|:

Repaso y aprendo

> 1. Transformaciones tecnolégicas que cambiaron a) Bicicleta, cinematégrafo y camara fotografica.
la vida cotidiana de la sociedad durante el 6) Ferrocarril, diligencias e industrializacién.
Porfiriato. ¢) Modos de vestir, mineria y textiles,

> 2. Lee el fragmento del siguiente Plan
‘Revolucionario:

Se desconoce al actual Gobierno del general Diaz, ai como a todas

BT eloped wert: Leskacansioartnpapeense
con los elementos que el pueblo puso a su disposicién para la
defensa de sus intereses, el fraude electoral més escandaloso que
registra la historia de México.

~> Elige la opcién que contenga al personaje que a) Alvaro Obregén.

elaboré el anterior Plan. 6) Francisco I. Madero.
c) Venustiano Carranza.
> 3. Maximos representantes de los intereses a) Francisco I. Madero y Pascual Orozco.
campesinos durante la Revolucion Mexicana. 6) Emiliano Zapata y Francisco Villa.

¢) Venustiano Carranza y Alvaro Obregon.

> 4. Son los articulos que contienen las principales a) 1°, 3°y 123.
arantias establecidas en la Constitucién Politica b) 3°, 27 y 84,
de México, ¢) 3°, 27 y 123.

> 5. Fue el pais que tuyo mas influencia cultural a) Francia.
sobre los grupos a de México scram 6) Inglaterra.
el Porfiriato. —_""",Comunismo
2008,2,35,"Autoevaluacion

> De acuerdo con lo que estudiaste en este bloque, coloca una Y enel cuadro
correspondiente, dependiendo de tu grado de aprendizaje.

Aspecto a evaluar Siempre Lo hago | Dificilmente

a veces lo hago

Ubico los principales acontecimientos del Porfiriato y
Ja Revolucién Mexicana aplicando los términos afio,
década y siglo.

Ubico algunos acontecimientos del Porfiriato y las zonas
de influencia de los caudillos que participaron en la
Revolucién Mexicana.

Identifico las causas que consolidaron la dictadura de
Porfirio Diaz.

Reconozco el desarrollo econémico y el papel de la
inversi6n extranjera,

Identifico caracteristicas de la ciencia, la tecnologia y la
cultura de México desde fines del siglo x1x a inicios del
siglo xx.

Describo las condiciones de vida ¢ inconformidades de
los diferentes grupos sociales del Porfiriato.

"" Reconozco las ideas politicas de Madero y su influencia
Wiel iin de fe Révohicifn Mexicana:

"" Identifico momentos del desarrollo de la lucha armada _y
las propuestas de los caudillos revolucionarios.

Identifico las principales garantias establecidas en la
_ Constitucion de 1917, asi como nuestra forma de

""gobierno. ‘

\Fvaloro el legado que ha dejado la cultura revolucionaria
en nuestro presente.

; Reconozco el legado de la influencia cultural de otros",Populismo
2008,2,36,,Populismo
